Vivamus tortor. Duis mattis egestas metus. Aenean fermentum.,consequat metus sapien ut nunc vestibulum ante ipsum primis in faucibus,"[{10},{15},{30},{11}]"
"Cras non velit nec nisi vulputate nonummy. Maecenas tincidunt lacus at velit. Vivamus vel nulla eget eros elementum pellentesque. Quisque porta volutpat erat. Quisque erat eros, viverra eget, congue eget, semper rutrum, nulla.",ante ipsum primis in faucibus orci luctus et ultrices posuere,"[{1},{2},{3}]"
"Duis at velit eu est congue elementum. In hac habitasse platea dictumst. Morbi vestibulum, velit id pretium iaculis, diam erat fermentum justo, nec condimentum neque sapien placerat ante. Nulla justo. Aliquam quis turpis eget elit sodales scelerisque. Mauris sit amet eros. Suspendisse accumsan tortor quis turpis. Sed ante.",nisi volutpat eleifend donec ut dolor morbi vel lectus in quam fringilla,"[{2},{15}]"
Suspendisse potenti. In eleifend quam a odio. In hac habitasse platea dictumst. Maecenas ut massa quis augue luctus tincidunt. Nulla mollis molestie lorem. Quisque ut erat.,at turpis donec posuere metus vitae ipsum aliquam non mauris morbi non lectus aliquam sit amet diam,"[{10},{20},{30},{40},{50},{60},{70}]"
"In blandit ultrices enim. Lorem ipsum dolor sit amet, consectetuer adipiscing elit. Proin interdum mauris non ligula pellentesque ultrices.",vulputate ut ultrices vel augue vestibulum ante ipsum primis in faucibus orci luctus et ultrices,"[{1},{2},{3},{10},{11},{12},{20},{21},{22},{23}]"
"Aenean sit amet justo. Morbi ut odio. Cras mi pede, malesuada in, imperdiet et, commodo vulputate, justo. In blandit ultrices enim. Lorem ipsum dolor sit amet, consectetuer adipiscing elit. Proin interdum mauris non ligula pellentesque ultrices. Phasellus id sapien in sapien iaculis congue. Vivamus metus arcu, adipiscing molestie, hendrerit at, vulputate vitae, nisl.",duis mattis egestas metus aenean fermentum donec ut mauris eget massa tempor convallis nulla neque libero convallis eget eleifend luctus,[]
"Vestibulum rutrum rutrum neque. Aenean auctor gravida sem. Praesent id massa id nisl venenatis lacinia. Aenean sit amet justo. Morbi ut odio. Cras mi pede, malesuada in, imperdiet et, commodo vulputate, justo.",ipsum integer a nibh in quis justo maecenas rhoncus aliquam lacus morbi quis tortor id nulla ultrices,"[{1},{9},{50},{55},{57},{58},{59},{70}]"
"Aenean lectus. Pellentesque eget nunc. Donec quis orci eget orci vehicula condimentum. Curabitur in libero ut massa volutpat convallis. Morbi odio odio, elementum eu, interdum eu, tincidunt in, leo. Maecenas pulvinar lobortis est. Phasellus sit amet erat. Nulla tempus. Vivamus in felis eu sapien cursus vestibulum. Proin eu mi.",id luctus nec molestie sed justo pellentesque viverra pede ac diam cras pellentesque volutpat dui maecenas tristique est,[{20}]
"Pellentesque ultrices mattis odio. Donec vitae nisi. Nam ultrices, libero non mattis pulvinar, nulla pede ullamcorper augue, a suscipit nulla elit ac nulla.",aliquam sit amet diam in magna bibendum imperdiet nullam orci pede venenatis non sodales sed,"[{7},{8},{42},{41},{39},{33},{3},{40},{60}]"
"Sed ante. Vivamus tortor. Duis mattis egestas metus. Aenean fermentum. Donec ut mauris eget massa tempor convallis. Nulla neque libero, convallis eget, eleifend luctus, ultricies eu, nibh. Quisque id justo sit amet sapien dignissim vestibulum. Vestibulum ante ipsum primis in faucibus orci luctus et ultrices posuere cubilia Curae; Nulla dapibus dolor vel est. Donec odio justo, sollicitudin ut, suscipit a, feugiat et, eros.",vel accumsan tellus nisi eu orci mauris lacinia sapien quis libero,"[{60},{65},{70},{75}]"
